{
  "$schema": "https://json-schema.org/draft/2020-12/schema",
  "title": "UM-MCI context ontology",
  "type": "object",
  "required": [
    "package",
    "governance_context_dimensions",
    "affordance_context_dimensions"
  ],
  "properties": {
    "package": {
      "type": "object"
    },
    "governance_context_dimensions": {
      "type": "array",
      "items": {
        "type": "object",
        "required": [
          "dimension_id",
          "label",
          "type"
        ],
        "properties": {
          "dimension_id": {
            "type": "string"
          },
          "label": {
            "type": "string"
          },
          "description": {
            "type": "string"
          },
          "type": {
            "type": "string"
          },
          "levels": {
            "type": "array",
            "items": {
              "type": [
                "integer",
                "string"
              ]
            }
          },
          "anchors": {
            "oneOf": [
              {
                "type": "object",
                "additionalProperties": {
                  "type": "string"
                }
              },
              {
                "type": "array",
                "items": {
                  "type": "object",
                  "additionalProperties": true
                }
              }
            ]
          },
          "values": {
            "type": "array",
            "items": {
              "oneOf": [
                {
                  "type": "string"
                },
                {
                  "type": "object",
                  "required": [
                    "value_id",
                    "label"
                  ],
                  "properties": {
                    "value_id": {
                      "type": "string"
                    },
                    "label": {
                      "type": "string"
                    },
                    "description": {
                      "type": "string"
                    }
                  },
                  "additionalProperties": false
                }
              ]
            }
          },
          "default": {
            "type": [
              "string",
              "integer",
              "boolean"
            ]
          },
          "notes": {
            "type": "string"
          },
          "fields": {
            "type": "object",
            "additionalProperties": {
              "oneOf": [
                {
                  "type": "object",
                  "properties": {
                    "type": {
                      "type": "string"
                    },
                    "default": {
                      "type": [
                        "string",
                        "integer",
                        "boolean"
                      ]
                    },
                    "values": {
                      "type": "array",
                      "items": {
                        "type": [
                          "string",
                          "object"
                        ]
                      }
                    },
                    "levels": {
                      "type": "array",
                      "items": {
                        "type": [
                          "integer",
                          "string"
                        ]
                      }
                    },
                    "anchors": {
                      "oneOf": [
                        {
                          "type": "object",
                          "additionalProperties": {
                            "type": "string"
                          }
                        },
                        {
                          "type": "array"
                        }
                      ]
                    }
                  },
                  "additionalProperties": true
                }
              ]
            }
          },
          "scale": {
            "type": "object",
            "additionalProperties": true
          }
        },
        "additionalProperties": false
      }
    },
    "affordance_context_dimensions": {
      "type": "array",
      "items": {
        "type": "object",
        "required": [
          "dimension_id",
          "label",
          "type"
        ],
        "properties": {
          "dimension_id": {
            "type": "string"
          },
          "label": {
            "type": "string"
          },
          "description": {
            "type": "string"
          },
          "type": {
            "type": "string"
          },
          "levels": {
            "type": "array",
            "items": {
              "type": [
                "integer",
                "string"
              ]
            }
          },
          "anchors": {
            "oneOf": [
              {
                "type": "object",
                "additionalProperties": {
                  "type": "string"
                }
              },
              {
                "type": "array",
                "items": {
                  "type": "object",
                  "additionalProperties": true
                }
              }
            ]
          },
          "values": {
            "type": "array",
            "items": {
              "oneOf": [
                {
                  "type": "string"
                },
                {
                  "type": "object",
                  "required": [
                    "value_id",
                    "label"
                  ],
                  "properties": {
                    "value_id": {
                      "type": "string"
                    },
                    "label": {
                      "type": "string"
                    },
                    "description": {
                      "type": "string"
                    }
                  },
                  "additionalProperties": false
                }
              ]
            }
          },
          "default": {
            "type": [
              "string",
              "integer",
              "boolean"
            ]
          },
          "notes": {
            "type": "string"
          },
          "fields": {
            "type": "object",
            "additionalProperties": {
              "type": "object",
              "additionalProperties": true
            }
          },
          "scale": {
            "type": "object",
            "additionalProperties": true
          }
        },
        "additionalProperties": false
      }
    },
    "design_notes": {
      "type": "array",
      "items": {
        "type": "string"
      }
    },
    "distinction_rules": {
      "type": "array",
      "items": {
        "type": "object",
        "required": [
          "rule_id",
          "summary"
        ],
        "properties": {
          "rule_id": {
            "type": "string"
          },
          "summary": {
            "type": "string"
          },
          "tension_criteria": {
            "type": "array",
            "items": {
              "type": "string"
            }
          },
          "governance_criteria": {
            "type": "array",
            "items": {
              "type": "string"
            }
          },
          "affordance_criteria": {
            "type": "array",
            "items": {
              "type": "string"
            }
          }
        },
        "additionalProperties": false
      }
    }
  },
  "additionalProperties": false
}